"","num","title","content"
"882",1171,"이런 놈잇노?","상황따라 이러면 상대방 반응이 어떨까 궁금할 때내가 아닌 어떤 인격을 연기함그리고 상대 반응을 관찰"
"883",1172,"난 친구 앞에서는 엔팁되는 듯","ㅅㅂ 하나도 안 궁금한 남의 사생활 얘기를 주변 엔프피랑 엔팁들이 존나 해줘서 같이 반응해주다보니까 같이 오지랖 넓어짐"
"884",1173,"니들 거짓말 잘하냐?","나는 상대 속 읽는 게 개빨라서 거짓말 존나 함 이게 단순히 내 잘못을 숨기려는 게 아니고 걍 반응이 재미있어서... 반응만 보고 말해줄 때가 더 많음 마피아 같은 심리전도 잘하는듯 표정 관리 ㅆㅅㅌㅊ여서"
"885",1174,"내가 엣팁이라니","난 진짜 내가 왜 엣팁인지 모르겠어..ㄹㅇ.. 난 아닌것 같은데 왜 테스트볼때마다 앳팁이 나오냐 이말이야.. 근데 진짜 댓글쓰기도 겁-나 귀찮고.. 쓰고는 싶은데 쓰기 너무 귀찮아서 넘기고.. ㄹㅇ 아무 생각도 안하는것 같아.. 아니 사실 다른애들이 생각 정리할 시간 좀 줘.. 이럴때 나는 왜 그런 시간이 필요한지 모르겠어....... 왜 내가 엣팁일까"
"886",1177,"estp특) 인간관계","제목은 estp특이지만 그냥 내 얘기임.아는 estp가 나밖에 없어서 어쩔 수 없음.1. 오는 사람 안 막고 가는 사람 안 잡는다.2. 아는 사람은 많은데 친구는 몇 없다.3. 관심 가는 사람이 생기면 오래 다방면으로 관찰하는 편이다.4. 타인의 호감도가 0부터 시작해서 시간과 데이터가 쌓여야 올라간다. (인류애가 별로 없고, 관찰력이 좋고 직관력이 떨어져서 그런 것 같다)5. 멘탈이 가루가 되어 바스라지는 정도가 아니면 주변에 의지하고 싶지 않아 한다.6. 멘탈이 터져도 문제를 의식하고 해결책이 나오면 회복이 빠르다.7. '남에게는 남의 인생이 있겠지' 라고 생각하고 나와 의견이 달라도 그러려니 넘어간다. 왜냐면 내가 훈수 듣는 걸 별로 좋아하지 않고, 남에게 간섭하는 것 자체도 귀찮기 때문이다.8. 매사에 귀찮음이 있는 이유는 쓸데없는 걸 하는데 들어갈 시간을 모아 재미있는 걸 하면서 인생을 즐기고 싶기 때문이다. 그래서 잡생각도 별로 없고, 설령 잡생각이 들더라도 의미 없다는 생각이 들면 빠르게 끊어낸다.9. 'ㅅ발 존나 어쩌라고' 마인드가 마음속에 항상 있기 때문에 인간관계에서 스트레스 받는 일이 별로 없다. 남의 시선이 의식되긴 하지만 'ㅅ발 존나 어쩌라고' 하면서 무시한다.(솔직히 또라이 보듯 보는 시선을 조금 즐기는 것 같기도 같다.)10. 누구든 집착하면 바로 손절한다.11. '내가 대우받고 싶은 대로 대우하라' 라는 말을 좋아한다. '내로남불' 을 싫어한다.12. 모성애 등 몇몇 특수한 경우를 뺀 모든 인간관계는 기브앤테이크라고 생각한다.13. 솔직함을 좋아한다. 나의 솔직함도 좋아하고 타인이 나한테 보여주는 솔직함도 좋아한다. 내 자신이 남한테 상처를 잘 안 받기 때문에 쓸데없이 말 돌려서 표현하는 걸 시간 낭비라고 생각한다.그렇지만 사회화가 잘 되면 남이 나에게 원하는 모습이 뭔지 빠르게 캐치하고 페르소나를 잘 쓸 수 있게 된다.14. 외강내강 > 사회화 후 > 외유내강15. 가스라이팅(남을 구박해서 자존감을 깎는 것)의 반대(칭찬으로 남 자존감 올려주기)를 잘하고 좋아한다. 하지만 진심이 안 담긴 칭찬은 하지 않기 때문에 뛰어난 관찰력(Se)으로 상대의 장점을 찾아내려고 노력하는 편이다.16. 본받을 점이 있는 사람을 관찰하고 카피하려고 노력한 적이 있다.17. 평소 스탠스가 솔직함이지만 필요한 순간순간엔 가면을 자연스럽게 쓴다. 그리고 그것이 잘 먹히는 반응을 관찰하면 기분이 좋아진다.하지만 어쩌다보니 가면이 일상이 된다면 정말 좋지 않아질 수 있다. 탈주 마려워짐. (우리가 순발력은 좋지만 꾸준함에는 힘든 성격적 요인 때문인 것 같다.)18. f인 가까운 사람과 인생에서 한 번은 대판 싸운다. 그 이후로 f상대법을 익히게 된다. 하지만 마음속엔 항상 'ㅅ발 존나 어쩌라고' 가 있는 것은 변하지 않는다.19. 코로나 블루 걸림. 20. 좀 예의없는 사람을 보면 이새기는 살면서 뒤지게 처 맞아본 적이 없나? 하는 생각이 들어 깜짝깜짝 놀랄 때가 있다.더 적고싶은 말 있으면 댓글로 적어주세요 님들이거 타유형 사람들이 estp 갤 놀러왔을때 보라고 적는거임"
"887",1179,"야 필찾있잖아","사람들 막 필찾 엄청 욕하잖아 근데 솔직히 다 필찾아님? 그리고 난 필찾이 당연하다고 생각하는데 안필요할때 왜찾아? 시간낭비아냐? 특히 연락할때 ㄹㅇ 뭐해뭐해충 개극혐싸발임 할말없어서 뭐해 뭐하긴 폰하지; 걍 필요할때만 서로서로 연락하면 서로 윈윈이잖아 왜 욕하는지 모르겠음 인쟝? 그런의미로 이런건 istp랑 연락하는거 잘맞드라 편해"
"888",1186,"니네는 진짜 친하다싶은 친구 몇명있냐","주기적으로 만나고 연락하는 친구 몇 명이나 됨? 나는 친구 사귈 때 넓고 얕게 사귀는 편이라 그런가 왤케... 편한 친구가 몇 없는 기분이지 진짜 친한 친구 생겨도 연락을 꾸준하게 하는 편도 아니고..."
"889",1187,"앞뒤 꽉막힌 사람은 무슨유형일까","흔히들 꼰대라고 하는 사람들은 무슨 유형인지 궁금하네 xntx일려나 "
"890",1188,"인생은 혼자다","오래된 생각이다"
"891",1189,"난....혈액형이랑같이","혈액형은B야 모임을 도모하고 정이좀깊어"
"892",1190,"ESTP 희망편 vs 절망편","         희망편 - 허예은(렛미인)엣팁 특유의 쿨한 성격으로 드릴드립도 쿨하게 받아드리며 큰 트라우마없이 질병극복, 현재는 결혼 준비중절망편 - 로봉순(모욕전과 19범)면접관에게 뭘쪼게 시전ㄹㅇㅋㅋ        "
"893",1191,"엣팁 열등기능 발현중이다 시바...","어떤갤러가 올려준 글 보니 다 내말ㅇㅣ다..몇년전 좋은회사 들어가서 얼마전까지 자신감있게 살았는데 (원래 자신감은 있었음)코로나때문에 재택하면서 일거리가 애매모호해지고 적당히 바쁘고 일처리 착착 해나가는게, 그러면서 퍼포먼스 내는게  일의 재미였는데뭔가 집에있으니 일이랑 함께 움직이는 느낌이 안들어서 일할맛 안난다일은 열심히는 하고 있는데, 현장에서 바로 사람들의 표정이랑 피드백 적당한 칭찬 등이 안오니까내가 제대로 하고 있는지도 모르겠고 어느순간 내가 주변 동기들이랑도 딱히 이야기 하기 싫어지고 뉴스 나오는것 봐도 다 안좋은뉴스같고 집도 사고 다 하고 싶은데 고정지출은 많고 회사 적자났다고 보너스 삭감된다는 소식도 들리고그런 이야기가 겹쳐서 또 스트레스고이대로 멈춰있는거 같아서 무력감이 장난ㅇㅏ니다.만성스트레스에 빠진듯. 진짜 사람들이랑 거리 두고 있는걸 깨달음...이거 읽기전엔 몰랐음.<U+00A0><U+00A0>2) ESTP와 ESFP의 열등기능으로써 내향직관(Ni)<U+00A0><U+00A0><U+00A0><U+00A0>- 내적 혼란<U+00A0><U+00A0><U+00A0><U+00A0>- 의미에 대한 부적절한 귀인<U+00A0><U+00A0><U+00A0><U+00A0>- 과장된 통찰■ 외향적 감각형(Se)의 만성적 스트레스에 사로잡혔을 때의 반응과 그 치료법<U+00A0><U+00A0>1) 만성적 스트레스에 사로잡혔을 때의 반응<U+00A0><U+00A0><U+00A0><U+00A0>- 행간의 부정적 암시를 읽어낸다.<U+00A0><U+00A0><U+00A0><U+00A0>- 타인들을 회피하고 거리를 둔다.<U+00A0><U+00A0><U+00A0><U+00A0>- “약간 편집적이 되어” 평범한 사건이나 설명으로부터 의미를 찾아내려 한다.<U+00A0><U+00A0><U+00A0><U+00A0>- 직장이나 집에서 무능감을 느낀다.<U+00A0><U+00A0><U+00A0><U+00A0>- 산만함, “장황하고 겉도는 대화”<U+00A0><U+00A0><U+00A0><U+00A0>- 만성적 불안과 불길한 예감<U+00A0><U+00A0>2) 벗어나기 위한 자원과 치료법<U+00A0><U+00A0><U+00A0><U+00A0>- 독서나 다른 활동에 참여함으로써 초점을 옮김<U+00A0><U+00A0><U+00A0><U+00A0>- 일하는 동안 산만함을 의식적으로 무시하거나 회피함<U+00A0><U+00A0><U+00A0><U+00A0>- 일할 때 타인에게 도움을 요청함<U+00A0><U+00A0><U+00A0><U+00A0>- 그들 고유의 정신적 안정성을 재 확신함<U+00A0><U+00A0><U+00A0><U+00A0>- 가능성과 다양한 선택을 하는데 도움을 받는다.<U+00A0><U+00A0><U+00A0><U+00A0>- 정보에 압도당하는 것을 줄이고, 확인하고, 조직화하는데 도움을 받는다. ■ 외향적 감각형(Se)의 열등기능 (ESTP, ESFP)<U+00A0><U+00A0>1) 열등기능의 계기<U+00A0><U+00A0><U+00A0><U+00A0>- 미래에 지나치게 초점을 둠<U+00A0><U+00A0><U+00A0><U+00A0>- 선택의 여지가 없음<U+00A0><U+00A0><U+00A0><U+00A0>- 지나치게 구조화된 활동<U+00A0><U+00A0>2) 열등기능에 사로잡히는 경험의 형태<U+00A0><U+00A0><U+00A0><U+00A0>- 내적 혼란<U+00A0><U+00A0><U+00A0><U+00A0>- 의미에 대한 부적절한 해석<U+00A0><U+00A0><U+00A0><U+00A0>- 과장된 통찰<U+00A0><U+00A0>3) 균형회복의 방법<U+00A0><U+00A0><U+00A0><U+00A0>- 긴급대책 계획하기<U+00A0><U+00A0><U+00A0><U+00A0>- “비참한” 결과로 간주된 것에 대해 타인들의 재확인 받기<U+00A0><U+00A0><U+00A0><U+00A0>- 우선순위 선정에 대한 타인의 도움<U+00A0><U+00A0>4) 새로운 통찰<U+00A0><U+00A0><U+00A0><U+00A0>- 일어날 일에 대한 두려움 감소<U+00A0><U+00A0><U+00A0><U+00A0>- 미지의 것들을 인정<U+00A0><U+00A0><U+00A0><U+00A0>- 그들 고유의 직관에 접근출처: https://mbti1.tistory.com/130 [MBTI :: 사유와 내면성찰]"
"894",1192,"SP로써 내 특징 써봄","1. 존나 충동적임<U+00A0><U+00A0>예시로 오늘 저녁은 해장국이랑께 결정하고 집밖을 나서도 갑자기 치킨집이 보여서 치킨이 조금이라도 먹고싶어지면 조금 고민하다가 한번에 팍 결정충동구매도 자주함 원래 구매계획 없었는데 맘에드는거 발견하면 지갑사정이 허락하는 내에서 확 해버리는 경우 많음<U+00A0><U+00A0>갑자기 친구가 재밌는거 하자 그러면 확 넘어가버림2. 근데 귀찮아재밌는거 하는거? 개좋지 근데 아무것도 안하고 가만히 있는것도 좋고방치우는것도 잘 안해서 ESFJ ISTJ 부모님한테 쿠사리듣고숙제,과제는 끝까지 미루다가 제한기간 전에 간신히 완성하는게 국룰3. 통제 간섭 매우 극혐함날 통제하려하고 간섭하는 사람이 세상에서 가장 싫음난 저사람이 나한테 피해를 끼치는 행동만 안한다면 뭐하는지 1도 관심없는데 왜 날 통제,간섭하려하는지 이해가 1도 안감4. 규칙 안지킴(당연히 법은 지키고)뭔가 규칙이 맘에 안들면 그냥 대놓고 어기는 경우도 많고 규칙이 딱히 맘에 안들지 않아도 ""규칙"" 이란거 자체가 맘에 드는 경우가 거의 없음. 몰래몰래 규칙 어기는걸 즐기는 성향도 있는거같음"
"895",1193,"진짜 진심반 장난반으로 죽이고 싶은데 어떡하지ㅎ",""
"896",1195,"너희 주식투자 이런거 잘하냐","난 해야지 해야지 하는데 계속 돈 노는 데에만 써서 몇개 못 함 ㅅㅂ"
"897",1196,"니네일머리있냐","난 ㅈㄴ없음서빙알바 30분했나 실실 쪼개기만하고 대충하는거보인다고 짤리고버거킹일할때 매니저가 일못한다고 개지랄해서 개싸우고 잘리고물론 난 일할때 나름의 노력을 했다고 생각하는데....... 그사람들한텐 대충으로 보여지나봄? 근데 또 객관적으로 보면 내가 일할때 실수가 좀 많은듯 까먹어서 빼먹는게 ㅇㅇ 그리고 좀 혼나면 받아들이긴 하는데 행동은 자꾸 돌려주게 됨... 하지말라는거 존나하고 스트레스 존나주고 그래야 속이 시원하고할수있는게 편의점뿐임 이제 대학생이라 그쪽지역에서 알바 아무거나 구해야하는데 좀 심각하네 편의점자리있기를"
"898",1197,"너네 고딩때 탐구과목 뭐했냐","         문돌이라서 쌍윤 걍 억지로 했는데 재미 좆도없고 성적도 안나와서6월쯤에 에라모르겠다 하고 사문 법정으로 바꿨는데 그전에 질질끌던것보다 훨씬잘나옴엣팁 잇팁은 공대 쪽이 많다던데 그것도 사회과학이라 그나마 괜찮았나infj 친구 수능 준비 하다가 윤리 너무 재밌다고 철학과 진지하게 고민하는 거 보고 진짜 신기하다고 생각했음        "
"899",1199,"안녕","여기다 이러는거 예의 아닌거 같아서 그냥 없앨게.. 다들 정말 감사합니다.. 내일 새벽 상체 조지러 감.."
"900",1201,"엣팁 남자 마음을 모르겠어","사람을 너무 헷갈리게 해평소에는 나 엄청 구박하고 무시해서 그럴 때마다 내가 기분 나쁜 티 내면바로 살짝 숙이고 들어오면서 딴 데로 화제 전환해그니까 뭔가 내 눈치를 보는데 자존심 상해서 안 보는 척하는 거지몇 달째 카톡할 때 이 패턴인데 이젠 얘가 나랑 뭘 하고 싶은 건지도 모르겟구ㅡㅡ같이 놀 땐 재밋으니까 잘 지내고 싶어서내 딴엔 말도 상냥하게 해 보고 맛있는 것도 사주고 힘들다 하면 위로도 해주고 그랬는데오히려 정떨어지게 만드는 반응만 돌아와 ㅡㅡ사람 만나몀서 이런 적 없었는데 되게 물질적으로나 감정적으로 사람을 계산하게 만들어..거리 둘까 싶으면 불러내서 놀자고 하고 ㅡㅡ근ㄷㅔ 나가면 폰만 쳐다보고 표정 썩은 채로 있고..모냐고 진짜 ㅡㅡ"
"901",1202,"3일 내내 놀다 들어왔는데 정말","각각 다른 친구들 만나고 애인만나고근데 집에 오자마자 외로워 정적이 너무 싫음 ㅆㅂ몸이 지쳐서 그런가 감정조절이 안되네 자야지"
"902",1203,"이 남자 ISFJ 라는데 귀엽지 않냐","https://youtu.be/Dvaz7WRlos4 "
"903",1204,"프로페셔널한 엣팁은 존나 호감이더라","         난 엔티제지만 계획을 분 단위로 빡빡하게 세우는 편이 아니고<U+00A0>그냥 큰 틀만 세우고 바로 바로 추진하는 타입이라 그런지 몰라도 일할때 중간에 끈기, 책임감 없이 내팽개치지 않고 무적권 끝을 볼려고 하는 열정 만수르 엣팁이랑 존나 잘 맞음. 게으른 엣팁은 존나 별로인데 부지런한 엣팁은 진짜 호불호 없을듯 싶어        "
"904",1205,"쌤한테 맨날 듣던 말 있었음","넌 할 건 다 잘해서 오는데 다른 사람 말을 잘 안 듣고 자기 혼자 해석해서 잘못 해온다고 그거만 고치라고 존나 들음 ㅅㅂ"
"905",1206,"나도 쌤한테 이 소리 많이 들었는데","‘넌 하면 잘하는데 왜 안하냐’ 이 소리만 학년 올라올때<U+00A0>3번이상 들음 뇌리에 걍 꽂힘 근데 그 소리들어도 안함 왜냐면... 존나 귀찮음 그냥"
"906",1207,"어? 화나네?","너가? 감히? 하 ㅋㅋㅋㅋ ㅆ1바 피의 복수 간다 ^^"
"907",1208,"나같은사람있나?","휴대폰으로 검사하면 몇번을 해도 estj-a나오는데"
"908",1209,"말 안 통할때","예를들어 상대방이 자꾸 안되는걸 요구한다그럼 거짓말로 그래! 할게! 말로만하고 안함<U+00A0>이런애들은 일단 안심을 시켜줘야 귀찮게 안굼하든말든 내맴~~;;"
"909",1210,"진짜 어릴때부터 자랑하는거 싫어했는데",""
"910",1211,"심심하니까 양자택일 ㄱ ㄱ","1.가사중심 vs 멜로디중심난 닥후 그래서 노래듣다가 댓글봣는데 다 이노래들으면 울컥한다길래 놀람 이노래가 그런노래였음? 하고 난 걍 무조건 멜로디좋은 노래 가사상관읎음2. 여행은쉬러가는거다vs 놀러가는거다음 난 전자로 호텔에서 쉬는것도좋고 놀러가서 막 사진찍는것도 나쁘진않긴한데 그 코스다짜진여행 개극혐 토할거같아 시간에 쫒겨서3. 잠자는거시간아깝다 vs 개좋다닥후 하루종일 자기 ㄱㄴ"
"911",1213,"나 ㅈㄴ 잘 스며드는거같음","옛날에 같이다니던애는 막 카페에서 사진찍고 인스타감성라 맨날 사진찍고 놀았는데 맨날 친구만 인생샷건지고 걘 사진 ㅈㄴ못찍어서 난 맨날 사진 못건짐 쨋든 그래도 맨날 예쁜데 찾아가면서 놈요새다니는애들은 사진안찍고 걍 지금중시?? 그니까 지금을 즐기는거지 ㅈㄴ 활동적인거하고<U+00A0>확실히 난 사진찍고노는것보단 후자가 맘편하더라 막 풀메하고 놀러가는것보단 편하게 쌩얼에마스크로 동네에서 노는게 더좋음<U+00A0>그래서 옛날엔<U+00A0> 먹는거 가는곳 하나하나 다 인스타 올리고그랫으면 요샌 당시를 즐기느라 폰거의 안해서 기록은 별로 없지만 그래도 즐즐!"
"912",1214,"아이돌 팬싸 볼하트 안하고 그런논란있잖아","모 아이돌이 영통팬싸에서 볼하트안해서 아이돌이 그런걸안하면뭐하냐하고 욕 ㅈㄴ먹었거든?근ㄷ 난 아이돌이 ㅈㄴ 불쌍하다고생각함<U+00A0>아니 나같으면 그돈주고 팬싸가서 애교안시킬거같음 막 아이돌이랑 엠비티아이토론하거나 얘기 ㅈㄴ할거같은데 얼마나 할거없으면 애교시키나 싶기도하고 애교영상은 유툽에쳐도 많잖아<U+00A0>친구들이랑 얘기해봤는데 다 나랑반대더라고 니들은 어케생각해?"
"913",1215,"아아 vs 라떼(단거)","ㅈㄱㄴ난얼죽아아 글ㅈㄴ써대네 좀 머쓱;;"
"914",1216,"야 여기 그래도 발전했다","         초창기도 아니고 9월달 쯤에는 지금처럼 매일매일 올라온 것도 아니고 며칠에 한 번 올라와서 '아 여기 씹인싸 mbti라서 많이 없네' 하고 말았는데<U+00A0>ㄱㅊ네 이 상태로 유지 됐으면 좋겠음 글 올라오는 속도가 너무 맘에듬 intp이런건 야갤처럼 후루룩 지나가서 조금 ㅈ같은데 여긴 ㄱㅊ네        "
"915",1220,"너네 외모에 관심 많은편?","난 그냥 관심없었거든? 꾸미는건 좋아하는데 그냥 자기만족 내 눈에만 평타치면됨~ 딱 끝 이거였단말임 심지어 누가 얼굴칭찬해도 별생각없고근데 연애하니까 갑자기 존나 신경쓰이네....그냥 이사람한테만 잘보이고싶음다른 사람이 내 얼굴 칭찬하는것도 전보다 더 기억에 오래남고애인이 칭찬하면 기분개좋아짐내가 얼굴 ㅈㄴ 막쓰는편이야 엽사도많이찍고애인이 거따 못생겼다고 웃으면희미하게 후회하는 정도가 되어부렀음ㅠㅠ외모 신경쓰는거 스트레스받는일이었구나......"
"916",1221,"니네 군생활 어땠음?","영외중대여서 상급부대 간섭이 별로 안 심했음 중대장이 부대 대빵이었고 중대장 결단하에 모든게 결정되던 시기가 있었는데  내가 상꺾? 상말쯤 중대장 대대장 다 바뀌었음 이전과는 다르게 중대장이 뭐만 하면 대대에 물어보고 대대장은 영외부대 관심 ㅈㄴ두고 완전히 바뀌어버린 부대에 적응을 못해갈 무렵 짬통은 채워져가고 겁대가리는 상실해가던 시기에 병장을 달음 나 있던 부대가 매달 스포츠리그 뭐할지 투표를 해서 투표 1등한 종목으로 리그가 결정되는데 6월에 배드민턴을 하기로 함 근데 갑자기 대대장이 본부대대에서 축구하니까 너네도 축구하라고 해서 배드민턴리그 엎어버리고 축구 시킴 그렇게 땡볕에 뒤지겠는데 축구리그를 시작함  그러다가 대대장이 부대방문해서 간담회하다가 애로 및 건의사항 있냐 하길래  내가 바로 우리는 배드민턴리그 하기로 했는데 왜 투표 순위권에 들지도 않은 축구해야되냐고 바로 물어봄 대대장이 듣자마자 관등성명 물어보고 자네는 원래 성격이 그런가? 시전 후에 중대장실로 끌려감 그러고 개닦임 그냥 생각나서 썰 풀어봄 "
"917",1222,"짜증나네 ㅋㅋ","나한테 관심도 없는 여사친 존나많은 어장남한테 폴인럽해버림 ㅋㅋ 아 ㅋㅋ ㅈ댐ㅋㅋ"
"918",1224,"야 너넨 유흥 안 좋아하냐?","나 진짜 유흥 처돌이거든클럽 헌팅 술 남자 진짜 좋아해 존나 재밌고 신남클럽은 재작년에 일 화수목금토일 이렇게<U+00A0>7일 연타로 가본 적 있음술 쳐먹고 노는 게 제일 재밌어...그럴 때 내가 살아있는 거 같아"
"919",1225,"너네두 이거 해봐","감정기복 빼고대부분 잘맞는거같움<U+00A0>https://kapable.github.io/kapable.github.io/personalColor/"
"920",1226,"요즘 롤 넘넘 잼있다","겉멋충이라 1티어 올라가있거나매드무비 봤으면 그챔 일단 해봐야됨딴애들 이길려고 하는데 혼자 오 시발 콤보맞춤오 이게 넘어가지네아 이거 조따 약하네이지ㅋ 이러고 분석하고있으면겜이암턴 나랑 상관없이 끝나는데저 혼잣말을 챗으로 치면서해서유쾌한 팀워크는 마니받음"
"921",1227,"니네도 주변에서 말리는 거 귓등으로도 안 들음?","내 나름대로 남한테 피해 안 주는 한에서 이렇게 하는 게 더 낫겠단 판단 들면 주변에서 너 그러다 좆된다 망한다 그렇게 하면 안될 거다하든말든 해버림넌 똥인 걸 굳이굳이 먹어봐야 똥인 걸 아냐는 소리도 들음 ㅋㅋ 근데 이렇게 해서 망할 때도 있고 잘될 때도 있지만 어쨌든 직접 경험해본 사람과 해보지도 않은 사람은 다르다고 생각해서 후회는 안 함 "
"922",1229,"배고프다 뭐먹지","집에서 해먹을수있고 존내 맛있는거 없나"
"923",1230,"야 알겟다","엔팁이 말 ㅈㄴ많음 ㄹㅇ개많아서 피곤해뒤질거같아내가 누구말을 듣고있는데도 말시키고 내가 누구랑 말하고있어도 말시키고 사람 귀찮게하는데에 ㄹㅇ 소질있는거같아난 걍 단답대잔치임"
"924",1231,"예의없는애들보면 ","막 두드려안맞아봤나 이런생각함다고 그랫잖아오늘 ㄹㅇ 강사초빙돼서 강의하는데 대놓고 엎드리고 안듣는척 오지게하는 예의말아먹은애들 대가리 갈기고싶었음 진짜솔직히 나도 나한테 지랄하는넘한텐 예의없게굴거든 근데 지랄도안한사람한테까지 예의안지키는건아니라고생각함 초면이잖아 선이있지;;;서로 친구들 존다고 눈뒤집혀진다고 깔깔웃고난린데 진심하나도안웃기고 ㅈㄴ예의없는거같아"
"925",1232,"나만 엔프피랑 개잘맞니","싸울땐 여기저기 말하고 아무나 다 끌고 지편 만드려고 해서 개좆같은데 놀 땐 개잘맞음 놀면 둘이 북치고 장구치고 제일 잘함... 표정에 기분 다 보이는데 또 대충 혼자 기분 금방 풀려서 대하기도 편하고 걍 딱 유흥거리 같이 하기 좋음 아님 내가 걍 엔프핀데 잘못 나온 건가"
"926",1235,"너흰 평소에 먼 생각 함","혹시 내가 adhd인가 멍 때릴 때 다들 암 생각 안 한다짆아 난 노래 가사만 생각함 내가 흥이랑 노래에 미치긴 했는데... 아무것도 안 할 땐 맨날 노래만 머리로 쳐부름 딴 생각은 하나도 안 하는 듯 너흰 다 ㄹㅇ 아무것도 생각 안 함?"
"927",1237,"잇엣팁인데","예전엔 여기 글리젠 안되서 맨날 잇팁갤에만 있어서 우중충 했는데 여기오니까 좀 밝아지는 느낌이네 ㅋㅋㅋ"
"928",1239,"컬러 테스트? 이거 뭐 나왔냐 ㅋㅋ",""
"929",1240,"내 mbti 컬러 뭐시기 테스트 결과 올려볼게","이거나옴 나랑 진짜 비슷 한 거 같음ㅋㅋㅋ 참고로 나는 estp-a 8w7 "
