"","num","title","content"
"1288",1720,"친구는 있는데 진짜 친한 친구는 없는 느낌이다 ㄹㅇ ㅋㅋ","친구들이 있긴 한데 ㄹㅇ 개친한 애들 없는 것 같다 ㅋㅋ 게다가 안 친한 애가 있어서 걔랑 친해질라고 하는데 톡 말투가 너무 나랑 반대임 ㅋㅋㅋㅋㅋㅋ"
"1289",1721,"난 이런 실수 많이 함","예를 들어 2랑 3중에 고민하고 있으면 그 2랑 3의 더 세부적인 부분을 보고 고민하지 정작 2랑 3에는 관심 없어서 2랑 3이었는지 3이랑 4였는지는 착각함 뭔 소린지 아냐... "
"1290",1722,"엣팁... 쾌남 쾌녀","난 그닥 쾌남 쾌녀 같지는 않은데막상 검사해보고 또 몇 개 읽어보면 나고... 빙고하면 몇 개 빼고 다 맞고...걍 자기객관화가 안 된 건가?뒤끝 없다는 소리도 많던데 사실 내가 뒤끝이 있는지 없는지도 잘 모르겠음 ㅋㅋ근데 난 은근 있다고 생각하는데..요즘 넘 집 안에만 있어서 그런가 무기력해지고 잡생각이 많아서 엠비티아이 같은 거에 관심도 많아지고걍 빨리 코로나 끝나고 운동이나 죽어라 하고 싶다"
"1291",1723,"나 엣팁인데 istp같음","ㅈㄱㄴ인데 뭐라해야지 E88%로 엄청 활발한데 P가 97%? 92인가 그쯤 되는걸로 알고이ㅆ음 그래서 그런지 무ㅓ든지 다 귀찮아하고 그러니까 i같기도 하다"
"1292",1724,"엣팁은 긴글 조나시러함","영화도 예고편으로다봄"
"1293",1725,"요몇일 엣팁인척 하는놈들 특징 분석해봄","존나 그놈들 특징1. 줄 3줄 이상 존나 징징거리거나:엣팁이 왜 글 길게 안쓸거라고 생각해? 주저리주저리<U+00A0><U+00A0>분석글-애초에 엣팁은 이딴 의구심을 품지않음. 2.쿨한척 2000년대 감성으로 글 싸지르거나:난 너무 잘났어. 난 사교적이야 ㅇㅈㄹ 굳이 이렇게 존나 티내면서 갤에서 관종짓 하지 않음. 3.자기객관화 안되서 엣팁에 대한 선망을 본인에게 투영하거나:나 엣팁인거 같은데? 혹은 엣팁 되고 싶은데? 결론은 내 최애 엣팁갤에서 물흐리지마라 초반에 나랑 비슷한 애들끼리 서로 ~~하지 않냐? 이런정도의 깔끔담백한 갤이었는데 존나 찐따 유입인지 패션엣팁인지 왜 어그로 새끼들 엣팁 갤에 끼고 싶어서 그래.. 그리고 엣팁은 별것도 아닌거에 논쟁 제일 싫어하니까 구구절절 길게좀 달지마라 피곤하게"
"1294",1727,"난 왜 좋아하는 사람한텐 말을 못하지","생각 존나 많아짐이성도 맘이 없으면 전화 막걸고 톡존나 막보내는데좋아하는 사람은 진짜 존나 조심스러워지고개찐따되네.. 이건 유형과 상관없겟지??"
"1295",1732,"내 친구 엣팁 맞는지 한번 봐줘봐바","안녕 난 엔프피야내 칭구가 엣팁이라 생각한 이유들을 나열해볼게- 내기에 환장함 이기면 좋아서 미침- 헬창- 겜창- 욕쟁이 (욕하는 게 재밌다고 함)- 썰풀기 좋아함 (주로 자기 과거썰 지인썰)- 돈이 들어오면 들어오는 대로 다 씀 (주로 옷 사는 데)- 걍 정신 놓고 부어라 마셔라 왁자지껄 노는 거 조아함- 술자리 분위기 메이커- 친구 없이 못 삼- 전화가 하루종일 옴- 놀리고 갈구는 게 애정표현- 눈치 개빠르고 타인의 감정 상태를 예민하게 읽어냄- 자기 주변 사람들 상황이나 개인 일정 등 한 번 들으면 잊어버리지 않고 늘 염두에 두고 있음- 가끔 좀 당황스러울 정도로 차갑게 굴 때 있음- 잔소리 치떨리게 싫어함- 자기는 단순한 사람이라고 계속 강조함- 인간관계에서 파워게임을 즐김 (우위에 있고 싶어 함)- 반대로 자기를 권력으로 누르려는 사람이 있어도 현 상황에서 거기에 놀아나는 게 최선이면 그냥 놀아남 (화도 안 내고 괘씸해 하지도 X)다음은 좀 긴가민가 하는 것들- 로코 멜로 덕후 ㅋㅋㅋㅋ달달한 거 좋아한다고 함- 은근히 소심하고 눈치를 많이 봄- 나한테 잘못한 걸 혼자 생각하고 있다가 내가 다 까먹었을 때 갑자기 미안하다고 사과함 (쫌 귀엽)- 거절에 대한 두려움이 있음- 감정기복이 있는데 본인은 없다고 생각을 하는 듯- 새로운 인연을 더 만들고 싶지 않아 하고 누굴 만나도 속으로 딱 관계의 한계치를 그어놓음 (챙길 친구가 이미 너무 많아서라고 함)너히들이 보기엔 어때?엠비티아이 시키면 귀찮다고 내던질 것 같은데아 남자임"
"1296",1733,"사칭 엣팁오면 안타까움","인프피련이 물흐리러왔네"
"1297",1735,"ESTP들 ISFP 싫지 ㅠㅠ...............","         나 잇프피여자인데 진짜 완전 잇프피야 잇프피 인간화하면 저럴까 이정도로근데 아마도 엣티피일 남자애 짝사랑중인데 잇프피 싫지ㅠㅠㅠㅠㅠㅠ그냥 서로 이름이랑 얼굴만 아는 정도인 사이야        "
"1298",1736,"니네도그렇냐","난 인프피나 인팁 보면 존나답답함"
"1299",1737,"ESTP 갤도 있네","         해당자 입갤        "
"1300",1738,"내가 엣팁이 아니란다","지는 뭐길래 도대체 왜 내 mbti를 운운하는거냐  엣팁은 맨날 쿨하기만 하냐고..^^  파생글 쓰기 싫었는데 짜증나 돌아버리겠네ㅠ 저런 애들보면 엣팁한테 무슨 로망 있나 싶음  내가 뭘 해도 아니라고 하겠지ㅋㅋㅋ  즈그갤로 가던가 타갤까지 와서 이럴 일이야?  "
"1301",1739,"제일 부질없는게 영화보기 먹방보기인듯","그걸왜하는거지 걍쳐먹고 예고편보셈"
"1302",1740,"니네 민초 이런거좋아하냐…?","난그닥"
"1303",1741,"안녕","나 요즘 너네가 넘 좋아져서 한 번 놀러와봤다 난 엔팁임  잘 부탁해~ㅎㅎ "
"1304",1742,"엣팁이 보통 어른같음","인팁이나 인프제는 유치원생가틈"
"1305",1743,"내가엔팁인지 엣팁인지궁금함","질문 던져주라 "
"1306",1744,"펌)링크) estp에 대한 내용","https://m.dcinside.com/board/entp/74482 "
"1307",1745,"본인 엔팁인데 자존심이 그리 쌘가?","여기념글 말고 다른데 다 싸돌아 댕겨보니 존심이 너무쌔다 자기주장이 너무강하다 인데 난 솔직히 잘모르겠음 존심 쌔게 나간적 주장 강하게 내새운적 별로 없던거 같은데"
"1308",1746,"우리 누나 인프제인데","나름 잘 맞음 "
"1309",1747,"어쨰 올라오는 글들이 다 비슷하네","         예전에는 글들보면 공감되고 좀 웃겼던거 같은데 요즘은 또 서로 싸우기 바쁘네 싸우는거 안귀찮나용 ㅋㅋㅋㅋㅋㅋㅋ난 싸우는것도 귀찮아서 그래 하고 무시하는데.. 싸우지마요 여러분 행복하게 삽시다 인생뭐있나요 화이팅~        "
"1310",1750,"반려동물도 mbti가 있다면","울집 강아지는 intp로 추정됨<U+00A0>i 아예 짖지도 않고 어슬렁어슬렁 다님<U+00A0>n 어디있나~~? 하고 찾으면 베란다에 혼자 있음<U+00A0>t 자기주장 ㅆㅅㅌㅊ 개키우는 사람들 알거임ㅋㅋp 돌발행동 할 때 있어서 잘지켜봐야됨<U+00A0>속정 많은 츤데레 갱얼쥐"
"1311",1751,"날씨 짱좋아","나가놀자 ~ 웃힝"
"1312",1752,"너네 운동 좋아하냐","난 레슬링함"
"1313",1753,"5년을 estp로 살았는데 바뀜 ㅋㅋㅋㅋ","         방금 isfp 나왔음ㅋㅋ 근데 i가 51퍼 f도 51퍼임..<U+00A0>그냥 e하고 i, t하고 f가 반반인데 왔다갔다 하는 듯        "
"1314",1754,"난 존나 애늙은이란 소리자주들음…","나만그렇니"
"1315",1755,"개 매운맛 ESTP","https://youtu.be/jWoBtcFw040"
"1316",1756,"너넨 귀여운 애들 어케 생각하냐","난 좀 좋아하는 편"
"1317",1757,"안녕하세요!!! 저는 isfj입니다!","남자친구가 estp라서 어떤 사람일까 궁금해서 들어와봤어요ㅠㅠ 사실 글 못 쓰고 안 쓰는데 술 마셔서 용기가 조금 생겼어요!!!ㅎㅎㅎ estp분들이 싫어하는 행동이 뭘까요?! 남자친구한테 안 하려구요ㅠㅠㅠㅠㅠ 소심하고 남 눈치 보고 이런 것도 싫어할까요??ㅠㅠ "
"1318",1758,"나만 포맨 좋아하나 자네들","외롭다"
"1319",1760,"엣프피 왜 좋아함?","궁금함"
"1320",1761,"enfp여자 좋아하는 estp인데 가능하냐","ㅅㅂ 상극중에 상극이라는데조언좀"
"1321",1764,"난 거짓말 하면 되게 잘먹혀","평소엔 존나 솔직하고 속마음 1도 숨김없이 얘기 다 하니깐 주변에서 인식이 그렇게 박혀있어서 가끔가다 거짓말해야 하는 상황에서 잘먹히는듯 구라쳐도 평소 이미지가 존내 솔직한 사람으로 박혀있어서 그런가봐 "
"1322",1765,"점믿는것도mbti미치나","난믿어"
"1323",1766,"직관력 다뒤져버렸네","         ㅠㅠ 어떻게 이럴수가        "
"1324",1767,"난 친구 사귈 때","몇번 얘기하고 아 얘랑은 걍 이정도까지만 친해지겠다... 이런 느낌이면 걍 관계에서 노력을 안 함 관심도 옶고 완전 필찾 됨 그렇다고 걔들한테 벽은 없는데 오는 사람 안 막고 굳이 부르지도 않음 내가 좋다싶은 애들한테만 존나 진심으로 대해서 싸우거나 손절하는 일도 없는듯 그렇다고 굽히는 건 아님 관계에서 유대감보다는 무조건 재밋게 노는 용도임 걍 가족도 못 오는 벽이 있어 막 회피형은 아니고 그럴 생각을 아예 안 해 너희도 이런가 궁금해서"
"1325",1768,"직관력 뒤진게이 이거한번해보셈","https://m.dcinside.com/board/entp/73428  한끗차이인 entp는 이거 동그라미 거의 다 되더라..  s랑 n 차이가  먼가 차이가 되게 큰거같아  "
"1326",1769,"이거 해왔어","         나는 정말 매력적이구나        "
"1327",1770,"너네 나랑같나 자네들","낮보다 밤이더좋고밝은거보다 어두운게좋음"
"1328",1771,"보수적인 사람 어케 생각함 다들","ㄹㅇ 친구나 부모님이나 보수적이라 말이 ㅈㄴ 안 통하네자기 가치관을 남한테 강요하고 그게 맞다고 우기듯이 얘기하는데 답답하다 ㅋㅋㅋㅋㅋㅋ"
"1329",1772,"내가 존나 센스가 없는건가"," 나 돌려말하는거 진짜 못알아먹는듯 진짜 센스가 나가뒤진거 같음...가령 친구들의 대화에서ENFJ - ""너네 화장실 안갈거지??"" ESTP- ""응 난 안가"" ENFP-<U+00A0><U+00A0>""우리 여기서 기다릴게 다녀와"" 이러고 엔프제는 화장실감ㅋㅋㅋㅋㅋㅋㅋ너네라면 저 질문에 어케 대답할거임??나 진짜 센스가 개 부족한거냐..시발...센스있는 엣팁들아 조언좀"
"1330",1773,"형 믿고있었다고","5252"
"1331",1775,"턱 뒤에 여드름 톡 짰는데","피가 줄줄 나오네 뭔가 썩은 피가 나오는 것 같아서 기분이 좋다. 약간 흥분되네"
"1332",1776,"엣팁 너네도 이러냐","애인이 기 별로 안세고 조신하게 말같은거 잘들어줬으면 좋겠음.근데 답답하면 짜증남.친한친구중에 검색부터 안하고 나한테 물어보는 핑프있으면 개답답해서 면전에 개쌍욕박음.근데 물어보는거 대답 잘해줌.처음보는 사람한테 엄청 친절하게 하는데 친한친구한테 싸가지없게함.대화할때나 카톡 같은거 할때 감정표현 잘 안함.일 잘한다는 소리 많이들음.진심으로 빡치는일 있으면 고소를 하던 끝을 봐야함.약간 빡치는일은 유튜브좀 보고있으면 까먹음.집에 있는거 별로 안좋아함 아무리 피곤해도 카페인 들이키면서 나가서 놈."
"1333",1778,"estp 나왔는데","         나는 외향형보다는 내향형인 것 같은데 그러면 앞에 e만 i로 바꿔도 됨?아니면 검사 다시 해야함? 두 번 정도 했는데 estp 나왔는데 뭔가 좀<U+00A0>아닌 것 같아서        "
"1334",1779,"좋아하는 사람","이번에 나랑 맞을꺼 같아서완전 무대포로 들이댐ㅎㅎ 먼가 부담스러운가봐..하긴 인기많은 그녀 이기도 하니까ㅎ이번 3개월정도 기다리고 내가 할수 있는건 다했어 선물도 주고근데 플러팅 실패다ㅋㅋㅋㅋㅋㅋㅋㅋㅋㅋ좃같네나정돈데 이정도 나오면 걍 맘 접어야겠지??ㅎㅎ이새벽 소주 깐다 스블..."
"1335",1780,"솔직히 ","엣팁되고싶은데 안되고싶음 엣팁 좋은 거 모기입대고 빨고싶네<U+00A0>"
"1336",1781,"생물학적 우위에요","         미혼남녀, 모쏠아다보다 저런 미성년자 싸튀충이 생물학적 우위에요.        "
"1337",1782,"주위에 누가 지 요구 안들어줬다고 삐져있으면 절대 위로안해줌ㅋㅋㅋㅋ","         1도 신경 안씀ㅋㅋㅋㅋㅋestp는 신경을 껏다 킬 수 있는 스위치가 있거든요^^        "
"1338",1783,"이거 일진 유형 맞지?","ㅇㅇ"
"1339",1784,"정보)펌)링크) ESTP&INFJ 관계성","https://m.dcinside.com/board/infj/32007 "
"1340",1785,"estp랑 entp랑 별차이없냐?","         둘다 내성격같아서 공감되는데 검사결과도 반반임        "
"1341",1786,"엣팁 강쥐주인","https://www.youtube.com/watch?v=AdMgVkp4OXI"
"1342",1787,"ISTP랑 연애중","         내가 약간 ESTP치고 감성적인 면이 강하거든그래서 ISTP가 약간 공감력이 부족한 특성이 있는진 모르겠는데 뭐 고민상담같은거 할 때 공감을 거의 아예 못해주고이성적으로만 말해줘서 그 때 좀 갈등 1번 있었음근데 나머지는 같이 있으면 편하고 좋음 ㅇㅇ        "
"1343",1788,"너희도 그러냐","조용할 때는 진짜 조용함 굳이 말 걸지도 않고 누가 화났냐고 물어볼 정도로 차분하고 조용함 (물론 ㅋㅋ 아무 생각 없이 있는기 건데 간혹 화났냐고 물어볼 때 있음)"
"1344",1790,"ESTP-a 다 질문 받는다",""
"1345",1791,"까글 보고싶어","다른 갤애 estp 까는글 많다는데 어디가 젤 많아?뭐라고 까는지 궁금해"
"1346",1792,"안녕 엣팁들아","ㅎㅇㅎㅇ "
"1347",1794,"글리젠실환가","하루 글 3개?  S N 차이가 일케 크노 인싸들은 다르다... "
"1348",1795,"엣팁 원래 카톡 이렇게 하니","친구가 엣팁인데얘가 시험이 한 달 정도 남았기도 하고 연락 귀찮아 하는 거면 안 하게...;;;이게 뭐하는 건지 모르겟슴"
"1349",1796,"수많은 엣팁글을 봤지만 이거 진짜 찐이다",""
"1350",1797,"3시간전에 산책하고 왔는디","ㅈㄴ 심심하네 애쉑들 다 학교 올라가서 아"
"1351",1798,"운전 개같이하는 차주들 걍 몸으로 들이받고싶음","우회전 그냥 사람없으면 해도 된다고 알고잇어서 그냥 8차선 저앞에 횡단보도 초록불이여도 우회전하면 그런갑다하는데. 싯팔 뭐가그리 급한지 내가 중앙선 넘어가는데도 우회전울 처할려고 속도내면서 달려오는 차량 걍 몸으로 뛰어서 유리창 부셔버리고싶음좌회전할때도 싯팔 보통 차량 신호등 빨간불 켜지고 횡단보도 몇초뒤에 초록불 켜지잖아 근데 그 신호등 한타임 기다리기 싫어서 걍 속도 ㅈㄴ내면서 좌회전 하는차량 진짜 한번 ㅈ되게 하고싶음 우회전은 보이기라도하지 좌회전은저멀리서 밟으면 잘못봄 그래서 횡단보도 건너려할때 앞으로 지나가면 진짜 부셔버리고싶어 ㅋㅋㅋㅋㅋ 분조장인가"
"1352",1799,"여기 처음 들어와서 게시물 하나하나 다 읽어봤는데","엉뚱하고 혼자 빙글빙글 돌고 귀엽다는 소리 많이 듣고(각자 얼굴보고 판단하겠지만) 학기 초에 친구 사귀려고 노력은 별로 안했는데 말 몇번 해주면 인기 엄청 많아지는 내 성격이랑 비슷한 사람들 많아서 놀람그리고 다 쿨한사람들이고 쿨찐은 싫어하는 그런 사람들일것같음"
"1353",1800,"헤이 엣팁 뷔치들 나랑 말싸움할사람","         선오브비치 섹온더비치 스섹의 도시 라스베가스에 열정넘사 엣팁밖에없을듯 혹은 엣팁한테 헤어나오지못해서 여러다리 걸쳐도 끌려다니는 인프피들<U+00A0><U+00A0>        "
"1354",1802,"자신만큼 연예인을 위한 덕질 가능?","요새 학폭이니 뭐 연예인 사건 많이 터지잖아.인터넷에서 우리 ㅇㅇㅇ 안그런다고 하면서 두팔 걷어서 막 가족일처럼 해명하고 막 빨아주는 사람들 보면 진짜 신기함.솔직히 덕질? 팬? 지나가다 오 얘 괜찮다 멋지네 정도임.덕질을 해본적 없는 엣팁으로서직접 만나는 지인한테도 관심이 없는 마당에 어떻게 좋아하는 마음으로만 그렇게 누군가에게 시간내고 돈쓰고 누구보다 편들어주고 댓글 달아주고 그렇게 정성스레 살수가 있는지 궁금함.내 뇌구조에 누군가를 동경하고 부러워하고 그런적이 거의 없음. 연예인도 그닥 외적으로 부럽거나 닮고싶다는 생각도 해본적 없음. (돈많은건 닮고싶다) 그냥 난 내가 좋아서 만족함(이건 좀 번외인데 한국 사회의 기형적으로 찍어내듯이 이쁘다 하는 외모 기준이 나와는 맞지 않음. 오히려 자신을 잘 표현하고 마인드가 멋지고 자신을 잘 꾸밀줄 아는 사람이 더 멋져보임=얼굴만 이쁘다고해서 별로 나한테 플러스 지수로 안다가온다는 소리. 그냥 이목구비 조화가 잘됐다 정도. 혹시 덕질, 팬, 이런거 해본 엣팁 있냐? 하다가 가입절차부터 존나 귀찮아서 때려칠거같긴한데애초에 팬이라는 개념이 우리한테 생길수 있음?관심이 조또 없는데 (정보 수집 차원에서 어디서 무슨일이 있는지 연예 경제 사회엔 빠삭함. 근데 그 사람자체엔 별 관심없음)"
"1355",1804,"내 전화번호함? 전화목록은","저장할 때 상대 이름 모르고 저장하는데 귀찮아서 안 물어보고 대충 ㅇ이라고 저장했다가 이룸 바꾸는거 까먹어서 친구 이름이 맨날 ㅇ이나 .이나 막 숫자임 하..."
"1356",1809,"난 인프제가 도어슬램하면","난걍 쌩까고 모르는사람 취급함"
"1357",1810,"병신같은새끼들 어디서 쳐맞고와서 엣팁들은 카톡할때 왜이러냐 이런글쓰냐","속으로 얼마나 뒤틀려서 살고있으면얜 무슨의도로 이렇게 보내는지? 왜 안보ㅡ지?이런거 생각하고 보내나저런새끼들 존나 답답함지 혼자 다른사람 판단하고 쟨저런새끼다 이런식으로 정하는거잖아"
"1358",1811,"같은 엣팁 첨보는데","말 되게 잘통함 ㅋㅋ이사람이 뭐에 흥분하는지 앎 ㅋㅋㅋㅋ어떤칭찬에 약한지도 앎 ㅋㅋㅋㅋ대화는 시원시원하고 즐거움"
"1359",1813,"entp estp 둘다 똑같아",""
"1360",1814,"초딩때부터 estp인데","지금도 똑같음 ㅋㅋㅋㅋㅋㅋㅋ초딩때도 내기억에 estp였고 고딩 생기부에도 엣팁 ㅋㅋ 그래서 그런데 인터넷 방송이나 유튜브 해보고싶움난 나에대해서 알려주는거 좋아하는데 친구들이랑 있을때 내 얘기만 하면 재미없자나? 친구들 얘기 듣는것도 귀찮기도하고<U+00A0>"
"1361",1815,"istp 빙고 해 봄","         빨간색이 나난 istp인가?        "
"1362",1816,"근데 카톡 할말다햇으면 그냥 끝나는거아님?","무슨 직장상사도아니고..나는 그냥얘기하다 할말없는말이거나 용건끝낫거나하면 걍 그대로 읽씹하는디..특히 상대가 응 그랰ㅋㅋㅋㅋ이런거보냇는데딱히 추가로할말없으면 그대로 그냥 씹는편인디원래 끝인사? 하는게 매너임?어느정도친분잇고 일주일에 한두번 톡하는사이고상하관계없음"
"1363",1820,"ESTP들 왜케 생각없냐","막말 존나 하고남들 다 무시하고적반하장으로자긴 잘못 없다고전부 다 남탓하는 게ㄹㅇ 일품이네일진 행세질 ㅅㅂ"
"1364",1821,"너희는 기분 안좋으면 혼자 삭히는 편??","일단 나는 엣팁티인데 혼자 삭히고 아무렇지않을때 사람들 앞에 나타남다른 엣팁들은 어때?"
"1365",1823,"혹시나해서했는데","역시는 또"
"1366",1824,"난 엣팁들이 존나 멋져","왜?일단 와꾸되고옷 잘입고쿨하고.선 안 넘지.내 사람한텐 한없이 잘한다.어쩔수 없이 자기애 뿜뿜이야.후..이건 뼛속부터 어쩔수 없는건가ㅎㅎ매력쟁이들 댓으로 모이자.근데귀찮짓??ㅋㅋㅋㅋㅋㅋㅋㅋㅋㅋㅋㅋㅋㅋㅋ"
"1367",1825,"승철아재도 엣팁같음","샤우팅이남다름"
"1368",1827,"estp 생각없다는 색기들에게",""
"1369",1828,"난 전혀 핫하지 않아",""
"1370",1830,"여긴 갤 리젠이 뒤졌구나","다들 현생 꾸려가는 멋쟁이들인갑네 "
"1371",1831,"엣팁 손절쳐도 끝까지 구질구질하게 ㅈㄹ함","생각이 워낙 짧고 없다보니자기 반성을 존나 극히 적게 하고남 괴롭히고도 별 죄책감 없음근데 만약 열등감까지 있다?남 인생 조지려고 자기 전부를다 내갖다 바칠 수 있는 놈들임뭐 니넨 니네가 일진이거나외모 좋다, 인기 많다, 당당하다이런 거에 내심 자부심 느끼겠지만니네가 전 유형 통틀어서 범죄율 1등의반사회성 범죄자들 유형인 것도 유념 바람요즘 학폭 논란 터지는 것도 딱히 문제 없어뵈지?나는 그중 상당수가 엣팁이라고 확신한다 ㅇ"
"1372",1832,"엣팁 존나 깐족깐족거리다가","성수당하기 쉬운 유형 아니냐 "
"1373",1834,"엣팁 까는 글이 많이 보이는데.","너네들 제발 자존감도 가져.남 깔 생각부터 하지말고.너네 자신을 잘 봐봐 마음으로너네 자신을 사랑하란 뜻이야.쫌!으이구."
"1374",1836,"유노윤호 엣팁같음","열정 만수르"
"1375",1837,"121.136 존나 구질구질하네ㅋㅌㅌㅌ",""
"1376",1838,"난 이미 떠나간 인연 신청안씀","지금만 잘살면댐"
"1377",1839,"stp 케장콘 만들려고 하는데 의견 받음",""
"1378",1840,"너네중에 롤 티어 높은사람잇냐","하 나는 엔터키를 뽑고해여하나봐 이번에도 진짜 정글 차이가 너무심한데 고집은 너무세서 개벌레련 한마디 첬눈대 바로정지그전에 채금좀 많이먹어서 진짜 최대항 순화해서 말한건데너무싫다 그냥"
"1379",1842,"야 이건 짚고 넘어가야 겠다 IP동일 한거.",""
"1380",1843,"118.235 kt 통피자나","걍 같은 통신사고 폰 lte망으로 갤질중이라는거임  별거아님  근데이제 통피가 아닌데 겹치면  같은 와이파이 잡고 쓴다는건데  그러면 뭐 ㄹㅇ 주변사람인거지  아 밑에 통피겹쳐서 논란있었구나  이쉑들 현실충이라 디알못인거 개웃기네  겹치기 싫으면 고닉을 파라 이말이야 "
"1381",1844,"뒷담 반응","누가 내 뒷담깐거 알게되면 너희는 어떻게 반응해? 난 그냥 음 내가 맘에 안드나 보네 알아서 욕하든 말든~~ 이러고 넘기는데 이거 내가 호구같은거야?"
"1382",1845,"념글요청) stp 케장콘 본격 착수 + 추가할 콘 추천받음","미리 3줄요약 "
"1383",1847,"최근들어 이상한 애들 유입 많은 거 사실임","엣팁 나오고 이 갤러리 알게 되면서 활동 했었어 요즘 글리젠 늘면서 그만큼 쿨찐들 존나 많아진 거 같노  몇 개월 전 처럼 글리젠 죽었을 때가 백배 낫다  엣팁한테 쳐 맞은 찐따들 기어올라오거나  쿨하다는 자신에게 취해 우월감 느끼는 애들 보니까 토할 거 같음  "
"1384",1851,"롤할때 남탓","난 롤할때 입 ㅈㄴ 털고 남탓도 ㅈㄴ 마니 하는데 너네도 그러니..?"
"1385",1852,"니들 펜트하우스 보냐?","         어떤 캐릭터 제일 좋아함? 주변에 stp들 보니까 유난히 주석경 좋아하길래 물어봄        "
"1386",1854,"나 estp esfp 둘 다 나온다","그런데 -a가 나온다누군가가 -a는 F성향이 표출되기 때문에나에게 esfp가 아니고 estp라고 했다그치만 난 esfp하고 싶으니깐 esfp해도 되겠지?"
"1387",1856,"엣팁임인데 커뮤는많이하는데 글은안씀댓글도","귀찮아 띄에쓰기도 오타나도 걍 씀 "
"1388",1857,"isfp 남자임","여자친구가 estp인데 서로 거의 정반대거든난 내성적인 데다가 할 말도 제대로 못하는 편이고여자친구는 무슨일이 있어도 할 말은 다 하는 편이란 말이야다른 성격 부분들도 거의다 반대되는 부분들이 많은데이 부분들이 서로 조화가 잘 돼서 그런가싸웠을 때도 여자친구가 오목조목 다 짚고 넘어가주면 그게 은근 속이 편하면서도 일이 금방 풀리더라이게 그저 mbti를 넘어선 성격 자체가 나랑 여자친구가 잘 맞는건지 몰라도 estp는 내가 지금까지 만난 사람들 중에 가장 잘 맞고 가장 편하고 가장 사랑스러워이렇게까지 내 마음 열고 편하게 한 없이 들이댄 적 처음이야"
"1389",1858,"엣팁한테 쳐맞는거","이유가있어서99%임"
"1390",1860,"estp와 entp의 차이점.jyp",""
"1391",1862,"어떡하냐 ㅇㅛ즘들어존나게을러짐","어떡하지시팔"
"1392",1863,"아니 갤상태 왜이럼 ㅋㅋ","오랜만에 왔는데 다른애들한테 점령당함??이상한글만있네"
