"","num","title","content"
"531",686,"estp 인데 니들도 샤회반항아적 기질 있냐?ㅇㅇ","         부당한 대우나 어렸을때는 선생들의 차별적 대우나 정당치 않은것에대해서 ㅈㄴ 불만이 많았음뭔가 부당하다 느끼면 무조건 개기고 면전에서 개기지못하면 어떻게던 다른수로던 표출했음그래서 항상 선생들이랑 갈등이 있었음 잘개기고 그만큼 잘찍혀서 미움을 많이 샀지어떻게보면 융퉁성 없는건데 내가 융퉁성 없다는거 알고 이 길로 가면 분명 나한테 더 피곤해지고 피해가 올거아는데절떄 안굽힘 내 자존심과 성격이 허락을안함졸업한지 엄청 오랜시간이 지나도 아직도 후회가안됨 걍 어린나이에 ㅈ도아닌 선생들한테 대들줄도아는 소리낼줄아는<U+00A0>똑똒한 놈이였구나 이생각듬군대에서도 심했음 부조리가 만연하고 분명히 이건 차별대우고 누구는 특혜인데 이것에대한 적개심이 엄청심했음난 요즘도 심함 아마 난 직장생활 절 때<U+00A0>못할듯그리고 누구보다 직설적이라 무조건 표정에 드러내거나 행동으로 표출함쿨한척이랑 좀 다름 끝까지 물고 뜯어짐 .<U+00A0>뭔가 정의의 베트맨은 아닌데 내 구역 내 바운더리에 침범했을떄 ㅈㄴ 부당함느끼면 무조건 소리내야됨<U+00A0>        "
"532",687,"난 내 성격 갈수록 너무 싫다","         좀 더 사려깊고 배려심 있고 누구나 착하다고 하는 성격이었음 좋겠어 내가 좋게 대하는 만큼 사람들이 내게<U+00A0>좋게 대하고 화도 줄이고 욕도 줄이고 항상 마인드도 바른 사람이고 싶고 낯도 안가리고 공손하고 인사성 바르고 싶은데<U+00A0>본성이 안그런건지 몰라도 나도 모르게 이기적이거나 다혈질적인 모습이 나오니까 너무 힘들다 장난기도 많고 떠드는 거 좋아하는 것도 좀 없었으면 좋겠음        "
"533",688,"타인한테 개인적인 관심은 없는데 인간군상 분석은 ㅈㄴ 재밌는거 나만그럼?","친구가 어떤 감정상태에 있을지 잘지내는지 즐거운지 이런거 미안하지만 관심없음친구가 어떤 기능을 주로 쓰고 어떤 기능이 열등한지 이런건 ㅈㄴ 관심많음 주변인들을 인간적인 정보단 데이터를 수집하고 분석한다는 느낌으로 접근하는듯Mbti공부좀 해보니까 부기능 Ti 영향인거같은데 맞냐"
"534",690,"내가 극 estp임","존나 일 저질러보는 스타일다른대학 편입하려고 학교 관두고 편입 실패 ㅅㅂ.그래서 모션디자인쪽으로 준비해서 8개월만에 취업근데 다니는 회사마다 ㅈ같아서 때려치고 3번이직함물론 이번회사도 손절해야겠다 맘먹음"
"535",691,"난 내가 얼빠가 아닌줄알았는데..","어쩌다가 연락하게된 여자애<U+00A0> 사진봤는데 얼굴이 개별로여서 개띠껍게 대하다가 사실 그사진 걔친구고 ㅈㄴ 귀엽게 생겨서  연락 하면서 잘해주는중  엣팁특이냐? "
"536",692,"엣팁이 존나 꼰대아님?","진짜 개 족같은 유형인거같음 "
"537",693,"인프피중에 이런새끼도 있음","이제 고3올라가는애인데 정식검사결과 infp뜨는 자칭 예술가인데 수업시간에 쌤한테 ㅈㄴ 이상한말해댐.Ex) 쌤 저 모고7등급인데 공부포기하고 웹툰작가할래요.만화에 나오는 메가데레 여자랑 사귀고싶어요.소설에 나오는것처럼 코로나로 사람이 전부죽고 저혼자 지구상에 살아남으면 어떻게되요?수능시험장에서 EDM틀면 어떻게되요?수능감독관은 매수될수있나요?(학기말에 영상보여줄때) 신태일의 대신맨봐요. 신태일랩들어요!저왕릉을 전투기로 폭격하면 어떻게되요?이런 이상한질문해대니까 애들이 고3이아니고 초3아니냐고 수군댐 ㅋㅋㅋㅋㅋㅋㅋㅋ 쌤들도 약간 이상한놈취급하는거 같기도하고"
"538",694,"너네 인프제 어떻게 생각해?","궁금하네"
"539",695,"사람들이 내앞에서 말을 너무 많이해","나는 사교활동은 좋은데인간관계는 큰 관심사가 아니기도 하고요새 일이 너무바빠서 걍 그러려니 맞장구를 쳐주거든근데 그게 본의아니게 잘들어주는 이미지가 돼서씹새들 내앞에서 별말을 다해그래서 화를 내면 삐약삐약 거리면서 상처받았다고 하니까내가 결국 홧병에 걸려서 시간당 8만원 주고상담센터를 갔는데상담사가또 말을 너무많이해몰카야 머ㅇㅑ시발미술치료 하재놓고 지그림을 왜그려 과거얘기 하래놓고 지 어린시절 얘긴 왜하냐고 엣팁이면 내가 tmi 해야되는거 아니냐기 떨어지니까 졸라 고통스럽다"
"540",697,"근데 원래 성격유형 바뀌는케이스 흔함?","나 원래 고1때까지 isfp 엿는데 estp됨  "
"541",698,"S랑 N 차이 ㅈㄴ큰 것 같음","학생 과외해주는데 이해가안되면 그거 생각하느라 수업 듣지를않음.. 난 이해 잘 안돼도 걍 시험에 나오니깐 외워야지..이러고 타협했는데 ㅋㅋ 난 얘가 특이한 줄 알았는데 N 친구가 공감하는 거 보고 경악 "
"542",699,"너희 카톡 프사","함? 난ㄴㄴ"
"543",700,"아니 조두순도 출소하면 민간인 아니냐?","조두순이란 걸 배제하고 생각해보자 "
"544",701,"씹프피진짜..","         진짜 열받고 아무리 욕하고 화내도 꺼지질 않음맨날 지 감성타령 웅앵 어쩌라고하 ㅠ 진짜스트레스받아        "
"545",702,"ㅎㅇㅎㅇ","이에스티피"
"546",703,"홍준표 엣팁이다","급호감 ㅋㅋㅋㅋ"
"547",704,"엣팁들아 너네 식욕 많냐","매 끼니가 귀찮은 잇팁씀"
"548",706,"너네 새로운 음식 시도하는거 좋아하냐","난 존나좋아함"
"549",708,"엣팁특인가이거","니들 뭐든 분석하는 거 좋아함?모든 상황에서 하나하나 따지는 게 아니라 그냥 분석하는 게 ㅈㅐ미잇는디정확한 통계나 지표도 좋아함"
"550",709,"mbti로 사람 나누는거만큼 븅슨짓이 없음","estp나오길래 디시에 쳐보니 모여서 븅쉰짓 하는구나ㅋ 무슨 종류별로 다있노 이건 "
"551",711,"어릴 때 삼촌이 내 방 내 침대 씀. TXT","         울집에서 제사 지내서 삼촌이 울집에 자주 왓는데오면 나한테 말 한마디 없이 내 방 내 침대 씀심지어 밖에서 입던 옷 빨래도 안하고 그대로 입고내 방 내 침대 씀애미 애비 삼촌 저때 모두 야구방망이로 구타 햇어야 햇는데 . .<U+00A0>개센징들은 대체 왜 이런거지 ..<U+00A0>        "
"552",713,"한국 애미들 의문점. TXT","         아이에 대해 철저히 통제 속박 지배 함.<U+00A0>계속 자기 멋대로 좌우.아이가 자신의 통제 속박 지배에 순응하도록 하기 위해서 아이에 대해서 조작 세뇌 무력화 한다.<U+00A0>저런 짓거리 계속 하며 자기가 아무 잘못 없다 믿음.저게 아이에게 무해하고 오직 좋기만 하다고 믿음.어떻게 왜 저렇게 확신 할까.<U+00A0>        "
"553",714,"한국 교새들 행태. TXT","         14. 학교폭력, 왕따, 은따, 학생들간의 갈등, 괴롭힘 : 방관, 방조, 조장, 무관심, 부추김, 웃음거리 만들기, 공개망신, 개망신주기- 학교폭력엔 관심도 별로 없고 해결하려는 노력, 의지도 없으면서 애들은 오질나게 갈궈뎀.<U+00A0> (정작 만만한 애 위주로 갈구고, 잘나가거나 영향력 있는 애한텐 끽소리 못하거나 다소 저자세로 나오고 잘 안건드림)- 실질적인 학교폭력, 소외 당하는 애, 왕따 은따엔 관심도 없고 도와주지도 않으면서<U+00A0> 되려 소외당하는 애 웃음거리 만들어놓고 이상한 애라고 낙인 찍어 놓음- 학교 폭력엔 관심도 없으면서 애들 머리 길이, 머리 묶는거엔 더럽게 관심..- 교사들에게는 체벌과 두발 규제가 학교폭력 방지 교육, 인성 교육이라고 생각하는 한국만의 정신병이 있음..        "
"554",716,"사람 애 취급 하는 새끼들 보면 진짜 개때리고 싶음","나이 몇살 더 쳐먹었다고 나이 어린사람 무시하는 보수 사상 찌들어 있는 틀딱 새끼가 대표적 ㅇㅇ"
"555",719,"미니 갤러리를 만들엇습니다.","https://gall.dcinside.com/mini/intp 만이만이 즐거운 갤질을 해주세요. "
"556",725,"이사람 무슨 유형같음?","뭐일꺼같음???? 존나 당황스럽네 "
"557",726,"엣팁이 존나 양아치같은데 맞냐","인티제인데 그래서 존나 맘에듬  상대하면 피곤하고 싸가지없어서 접점은 없는데 병신아 조까라 개의치 않는 태도가 맘에든다 "
"558",727,"엣팁 능지 좋은편이냐?","씹프피는 언급할가치도 없ㅅ는 쓰레기고  엣티제는 똑똑하고 대둥한 관계고  인팁은 인티제의 하위호환 관계  F는 다병신이니 상종안함 하등관계  엣팁은 도저히 모르겠다 지능은 높은거같은데  이새끼들이 일방적으로 쿨하게 피함  그래서 능지에 관계없이 대등한관계가 성립한단말이지  그 뻔뻔한 태도가 오히려 협상자로 만듬 엣팁한테 당하면 드는 생각이 니까짓게 날 능멸해? 요놈봐라? "
"559",728,"엣팁이 공감능력이 많이없음?","나 공감능력 좆도 없다는데 그렇다고 진짜 없는 공감능력을 억지로 만들어서까지 사람 비위맞춰주기가 그렇게 싫음 아 물론 슬픈상황이나 갑을관계면 어쩔수없이 맞춰주고.. "
"560",729,"왜 내 친구들은","다 nf임? 난 뼈엣팁인데"
"561",730,"텐구아레스 왤케 똑같은글 계속 싸질러?","애가 어린시절에서 갇혀사네 니 주변인들이라고 널 만나고 싶어 만났겠냐 세상사 우연이니까 어쩔수없이 관계가 그러니까 받아들이는거지 반대로 생각해봐 니 좋아하는 사람 몇명이나 있겠냐  "
"562",731,"엣팁이면 다 이거나오나","         내 주위 엣팁놈들 다 매일이이벤트상나옴즉흥적인건 ㅇㅈ        "
"563",732,"엣팁이 가장 좋은게","멍청한 사기꾼 마인드라 말과 행동에서 수가 다보여 이용해먹기 좋음 "
"564",733,"엣팁의 단점 말해준다","돌대가리 근자감 허세  멍청해서 자존감이 아닌 자존심만 셈 "
"565",734,"estp랑 entp 궁합이 좋은듯","부랄친구 세명 다 entp였음 신기하노"
"566",735,"Entj랑 estp이랑 보통 같이 있으면 쌍벽 아니냐 ㅋㅋㅋㅋ","난 entj고 estp들이랑 비율적으로 충돌이 잦았던 것 같더라 ㅋㅋㅋㅋ 보통 내가 의견 피력하는쪽이고 남들은 다 찬성하는데 신기하게도 반대하는 쪽은 평균적으로 estp인거 보고 신기하고 재밌었음 ㅋㅋㅋㅋㅋ 머 그래도 말썽 피우는거 대비 성과 잘 내는 거 봐서 estp들 괜찮음"
"567",736,"내가 사는 지구와 동떨어진","         네가 사는 지구엔 낭떠러지        "
"568",737,"이게 진짜 딱봐도 in인 새끼들은 티가 존나 남","         그냥 글쓰는 꼬라지 보면 몇 줄만 읽어도 개좆같은 부류가 있는데 그게 높은 확률로 in유형인 좆찐따새끼들임 댓글도 그렇고 그 특유의 좆같은 열등감과 찐따같은 불쾌함이 느껴지는데 왜 지들 노는 무리에서 안놀고 여기다가 좆도 의미없는 똥글 쳐싸는지 모르겠네ㅋㅋ 지금 밑에 보면 39.7하고 텐구아레스가 예시임        "
"569",738,"estp 짝사랑","estp 여잔데 나만 짝사랑하는 상대한텐 성격 확 바뀌냐? 내가 infj에서 estp로 바뀐 케이스라 그런건가 짝사랑할땐 성격이 infp같음"
"570",742,"와 여기 화력 진짜 안 좋구나ㅋㅋㅋ","좀만 내렸는데 5월 글이네..  나가서 놀지만 말고 글 좀 올려봐 얘들아... 인프피갤은 몇분에 한번 씩 올라오더라 존나신기 "
"571",743,"니넨 시발 왜 죄다 인싸냐","SN밖에 차이 안 나는데...존나 부럽네ㅋㅋ"
"572",745,"머 서치햇는데","별로쳐볼게 읍네현실형이래서 그렁거가?코로나라 개답답허재?내 생각상인데.<U+00A0><U+00A0>졸 건강하구<U+00A0><U+00A0>피지컬 조코피지컬로 따지믄 다 만만하고 좃밥으로 보이지 않나?나쁜의미가 아니라그게 정답 이라 본다하.. 머 별거 잇나~~~사실 좆밥이라 스트레스 받는 애덜이불쌍한? 거겟지 ㅋ그래서 피지컬 이라니깐왜 이딴거 걍쳐적으걍썅확"
"573",746,"친구도 별로 없고 말도 먼저 안하고 필요한 말만 하는 아싸인데","이거 나오는건 뭐냐 "
"574",747,"mbti","         보통 사람들은 얘기나왓을 때 한번해보고어 니나랑같냐??ㅋㅋㅋㅋㅋㅋㅋㅋㅋㅋㅋㅋㅋㅋ나무위키 들어가서 한번 읽어보고이야 나랑다똑같네 신기하넹이러고 마는데이제 찐따들은3차기능이어떻고저떻고s,p는 n,f하고 잘 안맞으니까estp인 나는 enfj인 쟤하고 잘 안맞겟지?아니면내가 쟤랑 안맞는이유는 쟤가 infp기 때문이야ㅇㅈㄹ함아니면 제가 estp고<U+00A0>제가 좋아하는애가<U+00A0>isfj에요 잘맞을까요?ㅠㅠㅠㅠ아니시발 븅신같이속으로 쟤는 isfj.. 이지랄 하는새끼를 누가좋아하냐?니가 논리형.. 감정형.. 분석하고 잇을시간에 다른놈이 먼저 채간다아니면 이제 나는 estp니까 현실적이고 논리적, 합리적이지이제 존나 빡쳐도 나는 estp니까 논리적이기 때문에 감정적이면 안돼역할놀이쳐하고잇음시발그냥 쳐맞고 집에와서 일기장 찌그릴거같은새끼들이난 estp인데왜찐따지? 이지랄 하는거역하다과몰입 하지말자        "
"575",748,"자 다 깨 서 와 밧 다  시 발 럼 들 아 ~~~ㆍ","아 늬 왜?진 짜발 바 닥 이<U+00A0><U+00A0>갑 자 기 처 가 렵 고지 럴 이 여.. 이 거 무슨 질 병 이 냐?이<U+00A0><U+00A0>개 놈 들 아...내 참..본 갤 에 서 분 탕? 을 쳐 쥬 실..나 무 애 비 타 불 님 이 부 르 지 도 안 앗 는 뎅쳐오셧다.인 사 박 아 라시 바 것 들 아.ㅋㅋ내 컨 쉪<U+00A0><U+00A0>ㅋㅋㅋㅋ앜..시 비 맨 ~~~~~~~~:)이 히 히 :)^^"
"576",749,"아 늬..  일 반 화 가 맞 지  이 건..","네 들은 왜 망상을 못 쳐 하 냨?ㅂㅅ 이야?<U+00A0><U+00A0>응?망상 왜 못 쳐 햌?개 야?개?멍멍?아님 야옹이 냐?야옹애옹?아늬망상을 왜 못 쳐해?뷰 ㅡㅡㅡㅡㅡㅡㅡㅡ웅 ㅡㅡㅡㅡㅡㅡㅡㅡㅡㅡㅡㅡㅡㅡㅡㅡㅡㅡ쉰 ㅡㅡㅡㅡㅡㅡㅡㅡㅡㅡㅡㅡㅡㅡㅡㅡㅡㅡㅡㅡㅡㅡㅡㅡㅡㅡㅡ새 끠 좆 밥 것 들 이 로 쿤.ㅋㅋㅋㅋㅋㅋㅋㅋㅋㅋㅋㅋㅋㅋ망상두 못 하는 겉 뜰...내 가 한<U+00A0><U+00A0>망상 부심좀.. 하지.아이고..진 짜 망상 못 하냐고!뷰<U+00A0><U+00A0> 신? ㅇ이 야?아 늬<U+00A0><U+00A0>왜?ㅋㅋㅋ."
